nombre,texto,img,ref,pais,info
"Alfonso Reyes","""Llegada tarde al banquete de la civilización europea, América vive saltando etapas, apresurando el paso y corriendo de una forma en otra, sin haber dado tiempo a que madure del todo la forma precedente. A veces, el salto es osado y la nueva forma tiene el aire de un alimento retirado del fuego antes de alcanzar su plena cocción. La tradición ha pesado menos, y esto explica la audacia. Pero falta todavía saber si el ritmo europeo —que procuramos alcanzar a grandes zancadas, no pudiendo emparejarlo a su paso medio—, es el único “tempo” histórico posible, y nadie ha demostrado todavía que una cierta aceleración del proceso sea contra natura.""",./reyes.jpeg,"Reyes, Alfonso. Notas sobre la inteligencia americana. Vol. 15. Latinoamérica. Cuadernos de Cultura Latinoamericana. México: UNAM - Unión de Universidad de América Latina, 1978. P. 5.",México
Leopoldo Zea,"""¡No volvamos a repetir la vieja historia, aceptando que solo seremos plenamente hombres, que tendremos una auténtica cultura y una no menos auténtica filosofía, cuando nos asemejemos, una vez más, al hombre occidental en su desarrollo!""",./zea.jpeg,"Zea, Leopoldo. La Filosofía americana como filosofía sin más. Colección Minima 30. México: Siglo XXI, 1978. P. 152",México,
"Gabriel Méndez Plancarte","""[...] el humanismo grecolatino es una de nuestras más hondas y fecundas raíces, uno de los elementos vitales y específicos que han plasmado nuestra fisonomía espiritual y han contribuido a formar lo que bien podemos, sin rústica jactancia, llamar la cultura mexicana.""",./mendezplancarte.jpeg,"Méndez Plancarte, Gabriel. “Los fundadores del Humanismo Mexicano”. Thesavrvs 1, núm. 2 (1945): 242–72. P. 242.",México
Augusto Salazar Bondy,"""Al lado de las filosofías vinculadas con los grandes bloques actuales o del futuro inmediato es preciso, pues, forjar un pensamiento que, a la vez que arraigue en la realidad histórico-social de nuestras comunidades y traduzca sus necesidades y metas, sirva como medio para cancelar el subdesarrollo y la dominación que tipifican nuestra condición histórica.""",./salazarbondy.png,"Salazar Bondy, Augusto. ¿Existe una filosofía de nuestra América? México: Siglo Veintiuno, 2006.",Perú
José Manuel Rivas Sacconi,"""[El conquistador] Quesada no fue un historiador, ni un poeta, ni un autor religioso, precisamente porque pasó por todas esas modalidades, sin circunscribirse a ninguna en particular. Fue humanista porque supo combinar tal universalidad de conocimientos con ciertas cualidades humanas, fundadas éstas y aquélla en una sólida y bien asimilada formación latino-clásica.""",./rivassacconi.jpeg,"Rivas Sacconi, José Manuel. “Exordios del humanismo en Colombia.” Thesavrvs 2, núm. 1 (1946): 55–84. P. 55.",Colombia,
Manuel Quintín Lame,"""Mis intenciones son de todo corazón proteger al futuro que duerme todavía en la ignorancia y que mañana le sirva esta obra de microscopio para hacerle frente al enemigo de nosotros los indígenas y que conozcamos la pradera de nuestros grandes destinos y no corramos como mujeres enamoradas abandonando el cariño de sus padres; y que busquemos la gran sociedad del estado de la civilización, porque nosotros los indios tenemos más memoria, y se nos presenta la inspiración más ligera que el relámpago que rompe el negro manto de la oscuridad de la noche. El indio se pasea mejor y más rápido que la abeja en todas las flores del jardín de las ciencias.""",./quintinlame.jpeg,"Quintín Lame, Manuel. En defensa de mi raza y otros textos. Bogotá: Biblioteca Básica de Cultura Colombiana, 2017.",Colombia,
Domingo Faustino Sarmiento,"""Puede ser muy injusto exterminar salvajes, sofocar civilizaciones nacientes, conquistar pueblos que están en posesión de un terreno privilegiado; pero gracias a esta injusticia, la América, en lugar de permanecer abandonada a los salvajes, incapaces de progreso, está ocupada hoy por la raza caucásica, la más perfecta, la más inteligente, la más bella y la más progresiva de las que pueblan la tierra. [...] No hay amalgama posible entre un pueblo salvaje y uno civilizado. Donde este ponga su pie, deliberada o indeliberadamente, el otro tiene que abandonar el terreno y la existencia""",./sarmiento.jpeg,"Sarmiento, Domingo Faustino. Obras de D. F. Sarmiento. Tomo II. Artículos Críticos y Literarios 1842-1853. Buenos Aires: Felix Lajouane, Editor, 1885. P.214-215",Argentina
Oswald de Andrade,"""Solo me interesa lo que no es mío. Ley del hombre. Ley del antropófago. [...] Fue porque nunca tuvimos gramáticas, ni colecciones de viejos vegetales. Y nunca supimos lo que era urbano, suburbano, fronterizo y continental. Perezosos en el mapamundi del Brasil. [...] Nunca fuimos catequizados. Lo que hicimos fue Carnaval. El indio vestido como senador del Imperio. Fingiendo ser Pitt. O apareciendo en las óperas de Alencar lleno de buenos sentimientos portugueses.""",./deandrade.jpeg,"de Andrade, Oswald. “Manifiesto Antropofago”. Revista de Antropofagia, mayo de 1928. P. 3",Brasil
Julia Martínez y Martínez,"""En esta época de vertiginosa marcha hacia adelante, hacia soñadas perfecciones, no ha de permanecer la mujer, cual petrificada esfinge, inalterable e indiferente á los ardientes rayos del progreso que iluminan su frente, ante el desbordamiento de fecundante limo que incesantemente la circunda. No ha de presenciar el soberbio espectáculo sorda y muda: sorda al clamor de las muchedumbres que sienten, piensan, aspiran y protestan; muda, cuando en su cerebro bullen ideas, cuando pesan sobre ella grandes injusticias y se le niega su concurso, se le limita, en el concierto de la humanidad. ¡La vida lánguida y monótona tras las celosías del harén, no es posible en medio de los esplendores de la civilización!""",./desconocido.jpg,"Martínez y Martínez, Julia. El Feminismo. Conferencia pronunciada en el Ateneo y Círculo de la Habana en la veladad del 18 de enero de 1912. 1912. P. 7",Cuba